<!ELEMENT articulos (articulo+)>
<!ELEMENT articulo (nombre,codigo,fabricante)>



<!ELEMENT nombre (#PCDATA)>
<!ELEMENT codigo (#PCDATA)>
<!ELEMENT fabricante (#PCDATA)>

<!ATTLIST codigo precio CDATA #REQUIRED>
<!--<!ATTLIST codigo precio (11.9  | 5.6 | 7.2) #REQUIRED>-->